{
  "module": "Silver Vein Whispers",
  "partyMembers": [],
  "partyNPCs": [],
  "worldConditions": {
    "year": 1492,
    "month": "Hammer",
    "day": 1,
    "time": "08:00:00",
    "weather": "Clear",
    "season": "Winter",
    "dayNightCycle": "Day",
    "moonPhase": "New Moon",
    "currentLocation": "Riverside R01",
    "currentLocationId": "R01",
    "currentArea": "Sablemoor Reaches",
    "currentAreaId": "SR001",
    "majorEventsUnderway": [],
    "politicalClimate": "",
    "activeEncounter": "",
    "activeCombatEncounter": "",
    "weatherConditions": "",
    "lastCompletedEncounter": ""
  },
  "activeQuests": []
}